{
  "id": "japanese-vocab-ko",
  "title": "일본어 기초 단어 (한국어로 배우는 일본어)",
  "source": "일본어 초급 학습자를 위한 기초 명사 어휘 정리",
  "cards": [
    {
      "id": "mizu-meaning",
      "type": "basic",
      "prompt": "일본어 단어 '水(みず)'는 한국어로 무슨 뜻인가요?",
      "answer": "물",
      "hint": "자연에서 흐르거나 고여 있는 투명한 액체예요."
    },
    {
      "id": "hi-meaning",
      "type": "mcq",
      "prompt": "일본어 단어 '火(ひ)'의 뜻으로 옳은 것은?",
      "answer": "불",
      "distractors": ["물", "나무", "바람"],
      "explanation": "'火'는 '火事(かじ, 화재)'처럼 '불'과 관련된 단어에 자주 쓰여요."
    },
    {
      "id": "yama-reading",
      "type": "cloze",
      "prompt": "산을 뜻하는 일본어 '山'은 히라가나로 {{やま}}라고 읽습니다.",
      "explanation": "'山登り(やまのぼり, 등산)'처럼 '山'은 기초 어휘에서 자주 등장해요."
    },
    {
      "id": "kawa-meaning",
      "type": "basic",
      "prompt": "일본어 단어 '川(かわ)'의 뜻은 무엇인가요?",
      "answer": "강 또는 하천"
    },
    {
      "id": "ki-meaning",
      "type": "mcq",
      "prompt": "일본어 단어 '木(き)'의 뜻으로 옳은 것은?",
      "answer": "나무",
      "distractors": ["꽃", "풀", "돌"]
    },
    {
      "id": "ame-reading",
      "type": "cloze",
      "prompt": "비를 뜻하는 일본어 '雨'는 히라가나로 {{あめ}}라고 읽습니다."
    },
    {
      "id": "sora-meaning",
      "type": "basic",
      "prompt": "일본어 단어 '空(そら)'의 뜻은 무엇인가요?",
      "answer": "하늘"
    },
    {
      "id": "hana-meaning",
      "type": "mcq",
      "prompt": "일본어 단어 '花(はな)'의 뜻으로 옳은 것은?",
      "answer": "꽃",
      "distractors": ["나무", "잎", "열매"]
    },
    {
      "id": "neko-reading",
      "type": "cloze",
      "prompt": "고양이를 뜻하는 일본어 '猫'는 히라가나로 {{ねこ}}라고 읽습니다.",
      "hint": "개를 뜻하는 '犬(いぬ)'와 헷갈리지 않도록 주의하세요."
    }
  ]
}
