{
  "id": "http-caching-essentials",
  "title": "HTTP caching essentials",
  "source": "RFC 9111: HTTP Caching",
  "cards": [
    {
      "id": "cache-control-max-age",
      "type": "basic",
      "prompt": "What does `Cache-Control: max-age=60` permit a cache to do?",
      "answer": "Treat a stored response as fresh for 60 seconds after it was generated, so it can be reused without revalidation.",
      "hint": "Think in terms of a freshness lifetime."
    },
    {
      "id": "cache-control-no-store",
      "type": "mcq",
      "prompt": "Which `Cache-Control` directive prevents a cache from storing a response?",
      "answer": "`no-store`",
      "distractors": [
        "`no-cache`",
        "`private`",
        "`max-age=60`"
      ],
      "explanation": "Use it for responses carrying sensitive data, such as a bank balance or a one-time login token: not even the browser's own private cache may keep a copy. Don't confuse it with `no-cache`, which allows storing but forces revalidation before every reuse."
    },
    {
      "id": "cache-control-no-cache",
      "type": "basic",
      "prompt": "What does the HTTP `Cache-Control: no-cache` directive mean for a stored response?",
      "answer": "A cache may store the response, but it must revalidate it with the origin before reusing it.",
      "hint": "It is different from `no-store`: storage is allowed, reuse without validation is not."
    },
    {
      "id": "etag-validator",
      "type": "cloze",
      "prompt": "To let clients revalidate cheaply, a server labels each version of a response with the {{ETag}} response header; the client sends that value back in `If-None-Match`.",
      "explanation": "A validator lets the client ask whether its stored copy is still current without downloading the full body again. At scale this matters: a site serving millions of unchanged images can answer each check with an empty `304` instead of re-sending the image."
    },
    {
      "id": "if-none-match-not-modified",
      "type": "mcq",
      "prompt": "A cache revalidates a stored response with a conditional `GET` carrying `If-None-Match`. If the origin's current `ETag` still matches, what status does the origin return?",
      "answer": "`304 Not Modified`",
      "distractors": [
        "`200 OK` with an empty body",
        "`204 No Content`",
        "`412 Precondition Failed`"
      ],
      "explanation": "A `304` carries no body, so the cache keeps serving the body it already stored. `412` belongs to the write-side precondition `If-Match` failing, which makes it an easy mix-up."
    },
    {
      "id": "vary-shared-cache",
      "type": "basic",
      "prompt": "What does the HTTP `Vary` response header tell a shared cache?",
      "answer": "Which request-header fields must match before a stored response can be reused for another request.",
      "hint": "The response may vary based on fields such as `Accept-Language`.",
      "explanation": "Get this wrong and a CDN can hand one visitor a page cached for someone else: the wrong language, or another user's personalized content."
    },
    {
      "id": "cache-control-private",
      "type": "basic",
      "prompt": "When should a response be marked `Cache-Control: private`?",
      "answer": "When it may be stored by a private browser cache but must not be stored by a shared cache.",
      "explanation": "Use it for personalized pages. Without it, a corporate proxy or CDN edge could store one user's page and replay it to the next visitor."
    },
    {
      "id": "stale-while-revalidate",
      "type": "basic",
      "prompt": "What does `Cache-Control: max-age=60, stale-while-revalidate=30` let a cache do in the 30 seconds after the response goes stale?",
      "answer": "Serve the stale response immediately while it revalidates with the origin in the background.",
      "hint": "The visitor never waits for the revalidation round trip.",
      "explanation": "This trades a few seconds of possible staleness for zero added latency, which is why it suits content that changes often but not critically, such as feeds or product listings."
    },
    {
      "id": "must-revalidate-during-outage",
      "type": "mcq",
      "prompt": "A stored response without `must-revalidate` has just gone stale, and the origin server cannot be reached. What may the cache do?",
      "answer": "Serve the stale response anyway.",
      "distractors": [
        "It must return `504 Gateway Timeout`.",
        "It must delete the stored response and fail.",
        "Treat the response as fresh for another full `max-age` period."
      ],
      "explanation": "Freshness is a soft limit: when disconnected, a cache may serve a stale response rather than fail. Adding `must-revalidate` makes the `504` option mandatory, trading availability for strict correctness."
    },
    {
      "id": "fingerprinted-assets",
      "type": "basic",
      "prompt": "Why do build tools put a content hash in asset filenames such as `app.3f9a1c.js`?",
      "answer": "So the file can be cached for a very long time, because any change to its content produces a new URL.",
      "explanation": "Hashed assets are typically served with `Cache-Control: max-age=31536000, immutable`. The HTML page that references them stays short-lived or `no-cache`, so it always points at the newest hashed URLs."
    }
  ]
}
