{
  "id": "japanese-reading-ko",
  "title": "가타카나 읽기와 일본어 문장 (한국어로 배우는 일본어)",
  "source": "일본어 초급 학습자를 위한 가타카나 읽기 연습과 기초 문장 정리",
  "cards": [
    {
      "id": "katakana-radio-reading",
      "type": "cloze",
      "prompt": "가타카나 단어 'ラジオ'(라디오)를 히라가나로 옮기면 {{らじお}}입니다.",
      "hint": "한 글자씩 대응하는 히라가나로 바꿔 보세요: ラ→ら, ジ→じ, オ→お.",
      "explanation": "가타카나와 히라가나는 소리가 같은 두 가지 문자 체계라서, 외래어를 가타카나로 쓰더라도 한 글자씩 그대로 히라가나로 치환할 수 있어요. 다만 실제로는 외래어를 히라가나로 적지 않고 항상 가타카나로만 표기합니다."
    },
    {
      "id": "katakana-camera-reading",
      "type": "cloze",
      "prompt": "가타카나 단어 'カメラ'(카메라)를 히라가나로 옮기면 {{かめら}}입니다.",
      "explanation": "カ・メ・ラ는 각각 か행과 ら행의 기본 글자라서 탁음이나 반탁점 없이 그대로 대응됩니다."
    },
    {
      "id": "katakana-banana-reading",
      "type": "cloze",
      "prompt": "가타카나 단어 'バナナ'(바나나)를 히라가나로 옮기면 {{ばなな}}입니다.",
      "explanation": "バ는 は행에 탁점(゛)이 붙은 글자로, 히라가나에서도 탁점을 그대로 유지해 ば가 됩니다."
    },
    {
      "id": "katakana-bread-reading",
      "type": "mcq",
      "prompt": "가타카나 단어 'パン'(빵)을 히라가나로 옳게 옮긴 것은?",
      "answer": "ぱん",
      "distractors": ["ばん", "はん", "ぱに"],
      "explanation": "パ는 は행에 반탁점(゜)이 붙은 글자라서 ぱ가 되고, ン은 받침 역할을 하는 글자라서 그대로 ん이 됩니다. 탁점(゛)이 붙은 ば나 반탁점이 없는 は로 착각하기 쉬운 대표적인 예예요."
    },
    {
      "id": "katakana-salad-reading",
      "type": "cloze",
      "prompt": "가타카나 단어 'サラダ'(샐러드)를 히라가나로 옮기면 {{さらだ}}입니다.",
      "explanation": "ダ는 た행에 탁점이 붙은 글자로 だ가 되며, サ・ラ는 각각 さ행과 ら행의 기본 글자라서 그대로 대응됩니다."
    },
    {
      "id": "sentence-this-is-a-book",
      "type": "mcq",
      "prompt": "다음 일본어 문장의 뜻으로 옳은 것은? 'これは本です。'",
      "answer": "이것은 책입니다.",
      "distractors": ["이것은 연필입니다.", "이것은 가방입니다.", "이것은 의자입니다."],
      "hint": "'本(ほん)'은 '책'을 뜻해요.",
      "explanation": "'これ'는 '이것', 조사 'は'는 문장의 주제를 나타내며, 'です'는 문장을 정중하게 끝맺는 서술형 조동사예요. 그래서 'これは○○です'는 '이것은 ○○입니다'라는 정중한 소개 표현의 기본형이 됩니다."
    },
    {
      "id": "sentence-i-am-a-student",
      "type": "mcq",
      "prompt": "다음 일본어 문장의 뜻으로 옳은 것은? '私は学生です。'",
      "answer": "저는 학생입니다.",
      "distractors": ["저는 선생님입니다.", "저는 회사원입니다.", "저는 의사입니다."],
      "explanation": "'私(わたし)'는 '나/저', '学生(がくせい)'는 '학생'이라는 뜻의 명사예요. 명사 뒤에 바로 'です'를 붙이면 '~입니다'라는 정중한 단정문이 됩니다."
    },
    {
      "id": "sentence-today-is-hot",
      "type": "mcq",
      "prompt": "다음 일본어 문장의 뜻으로 옳은 것은? '今日は暑いです。'",
      "answer": "오늘은 덥습니다.",
      "distractors": ["오늘은 춥습니다.", "오늘은 맑습니다.", "오늘은 흐립니다."],
      "explanation": "'暑い(あつい)'는 기본형이 'い'로 끝나는 い형용사예요. い형용사는 명사처럼 앞에 'だ' 없이도 바로 뒤에 'です'만 붙여 정중체를 만들 수 있어서, 'です' 앞의 형태가 바뀌지 않는다는 점이 な형용사와 다릅니다."
    },
    {
      "id": "sentence-i-like-cats",
      "type": "basic",
      "prompt": "다음 일본어 문장의 뜻은 무엇인가요? '猫が好きです。'",
      "answer": "고양이를 좋아합니다.",
      "hint": "'好きです(すきです)'는 '좋아합니다'라는 뜻이에요.",
      "explanation": "'好きだ'는 형태는 형용사(な형용사)지만 뜻은 '좋아하다'에 가까워서, 좋아하는 대상 뒤에는 목적격 조사 'を'가 아니라 주격 조사 'が'를 씁니다. 그래서 '猫を好きです'가 아니라 '猫が好きです'가 자연스러운 문장이에요."
    },
    {
      "id": "sentence-where-is-the-restroom",
      "type": "basic",
      "prompt": "다음 일본어 문장의 뜻은 무엇인가요? 'すみません、トイレはどこですか。'",
      "answer": "실례합니다, 화장실은 어디입니까?",
      "explanation": "'~はどこですか'는 '~은/는 어디입니까?'라는 뜻으로 장소를 물을 때 가장 많이 쓰는 패턴이에요. 문장 앞의 'すみません'은 사과보다 '실례합니다'처럼 낯선 사람에게 말을 걸 때 쓰는 관용 표현에 더 가깝습니다."
    }
  ]
}
