{
  "id": "japanese-mistakes-ko",
  "title": "한국인이 자주 틀리는 일본어",
  "source": "한국어 화자가 일본어를 배울 때 자주 하는 실수 모음",
  "cards": [
    {
      "id": "bus-ni-noru",
      "type": "mcq",
      "prompt": "'버스를 타다'를 일본어로 옳게 쓴 것은?",
      "answer": "バスに乗る",
      "distractors": ["バスを乗る", "バスで乗る", "バスが乗る"],
      "explanation": "乗る(のる, 노루)는 타는 대상을 조사 に로 받습니다. 한국어 '를'을 그대로 옮겨 を를 쓰는 것이 한국인이 가장 많이 하는 실수 중 하나예요. 반대로 내릴 때는 'バスを降りる(바스오 오리루)'처럼 を를 씁니다."
    },
    {
      "id": "tomodachi-ni-au",
      "type": "basic",
      "prompt": "'친구를 만나다'를 일본어로 말해 보세요.",
      "answer": "友達に会う (ともだちにあう, 토모다치니 아우)",
      "hint": "한국어 '를'을 그대로 옮기면 틀려요.",
      "explanation": "会う(あう)는 만나는 상대를 に로 받습니다. 약속하고 서로 만나는 느낌이라면 '友達と会う'도 자연스럽지만, '友達を会う'는 틀린 문장이에요."
    },
    {
      "id": "suki-ga",
      "type": "mcq",
      "prompt": "'나는 고양이를 좋아해요'를 일본어로 쓸 때, 빈칸에 들어갈 조사는? 私は猫＿好きです。",
      "answer": "が",
      "distractors": ["を", "に", "で"],
      "explanation": "好き(すき, 스키)는 동사가 아니라 な형용사라서 좋아하는 대상을 が로 표시합니다. 分かる(알다), 上手だ(잘하다), 欲しい(갖고 싶다)도 같은 패턴이에요. 예: 日本語が分かる(일본어를 알다)."
    },
    {
      "id": "kusuri-wo-nomu",
      "type": "basic",
      "prompt": "'약을 먹다'를 일본어로 자연스럽게 말해 보세요.",
      "answer": "薬を飲む (くすりをのむ, 쿠스리오 노무)",
      "hint": "食べる(먹다)가 아닙니다.",
      "explanation": "일본어에서는 알약도 물과 함께 삼키므로 '마시다'인 飲む를 씁니다. 한국어 '먹다'를 그대로 옮긴 '薬を食べる'는 약을 씹어 먹는 듯한 어색한 표현이에요."
    },
    {
      "id": "katakana-tsu",
      "type": "mcq",
      "prompt": "가타카나 'ツ'는 어떻게 읽을까요?",
      "answer": "쓰 (つ)",
      "distractors": ["시 (し)", "소 (そ)", "ㄴ 받침 소리 (ん)"],
      "explanation": "ツ는 점 두 개가 위쪽에 나란히 놓이고 긴 획을 위에서 아래로 내려 긋습니다. シ(시)는 점이 왼쪽에 세로로 놓이고 긴 획을 아래에서 위로 올려 긋죠. 점이 위에 있으면 ツ, 왼쪽에 있으면 シ로 기억하세요."
    },
    {
      "id": "katakana-n",
      "type": "mcq",
      "prompt": "가타카나 'ン'은 어떻게 읽을까요?",
      "answer": "ㄴ 받침 소리 (ん)",
      "distractors": ["소 (そ)", "시 (し)", "쓰 (つ)"],
      "explanation": "ン은 짧은 획이 가로에 가깝게 눕고 긴 획을 아래에서 위로 올려 긋습니다. ソ(소)는 짧은 획이 세로에 가깝고 긴 획을 위에서 아래로 내려 긋죠. 긴 획이 올라가면 ン, 내려가면 ソ입니다."
    },
    {
      "id": "mansion-meaning",
      "type": "mcq",
      "prompt": "일본 부동산 광고의 'マンション'은 보통 어떤 집일까요?",
      "answer": "철근 콘크리트로 지은, 한국의 아파트 같은 공동주택",
      "distractors": ["넓은 정원이 딸린 대저택", "목조로 지은 2층 정도의 소규모 공동주택", "마당이 있는 단독주택"],
      "explanation": "영어 mansion(대저택)과 달리 일본어 マンション은 한국의 아파트에 가까운 공동주택입니다. 목조나 경량 철골로 지은 소규모 공동주택은 アパート라고 불러서, 한국어 '아파트'와 뜻이 어긋나는 대표적인 예예요."
    },
    {
      "id": "viking-meaning",
      "type": "mcq",
      "prompt": "일본 호텔 안내문에 '朝食バイキング'이라고 적혀 있다면 무슨 뜻일까요?",
      "answer": "원하는 만큼 골라 먹는 뷔페식 아침 식사",
      "distractors": ["객실로 배달되는 아침 도시락", "해적선 테마로 꾸민 레스토랑의 아침 식사", "놀이공원 이용권이 포함된 아침 식사"],
      "explanation": "일본어 バイキング은 뷔페를 뜻합니다. 1958년 도쿄 제국호텔이 뷔페 레스토랑에 '바이킹'이라는 이름을 붙인 것이 퍼진 거예요. 한국에서 바이킹은 놀이기구라 더 헷갈리기 쉽습니다."
    },
    {
      "id": "sumimasen-calling-staff",
      "type": "mcq",
      "prompt": "일본 식당에서 점원을 부를 때 가장 자연스러운 말은?",
      "answer": "すみません",
      "distractors": ["ごめんなさい", "失礼します", "もしもし"],
      "explanation": "すみません(스미마셍)은 사과뿐 아니라 '저기요'처럼 사람을 부를 때나 가볍게 고마움을 전할 때도 씁니다. ごめんなさい는 주로 가까운 사이의 사과, 失礼します는 방에 들어가거나 나올 때, もしもし는 전화에서 쓰는 말이에요."
    },
    {
      "id": "kirei-na",
      "type": "mcq",
      "prompt": "'예쁜 꽃'을 일본어로 옳게 쓴 것은?",
      "answer": "きれいな花",
      "distractors": ["きれい花", "きれいの花", "きれいい花"],
      "explanation": "きれい(키레이)는 い로 끝나서 い형용사처럼 보이지만 실제로는 な형용사(한자 綺麗)라서, 명사를 꾸밀 때 な를 붙여야 합니다. 嫌い(きらい, 싫어하다)도 같은 함정이에요. 진짜 い형용사는 '暑い日(더운 날)'처럼 바로 명사 앞에 옵니다."
    }
  ]
}
